{
  "$schema": "../track.schema.json",
  "id": "ms",
  "title": "Moyenne section",
  "minStarsToUnlockNext": 1,
  "levels": [
    "ms-suite-01",
    "ms-compte-01",
    "ms-intrus-01",
    "ms-couleurs-01",
    "ms-robot-01",
    "ms-suite-02",
    "ms-compte-02",
    "ms-formes-01",
    "ms-intrus-02",
    "ms-code-01",
    "ms-tri-01",
    "ms-suite-03",
    "ms-suite-nature-01",
    "ms-compte-03",
    "ms-morpion-01",
    "ms-intrus-03",
    "ms-couleurs-02",
    "ms-suite-04",
    "ms-compte-04",
    "ms-robot-02",
    "ms-formes-02",
    "ms-intrus-04",
    "ms-tri-02",
    "ms-suite-05",
    "ms-code-02",
    "ms-suite-nature-02",
    "ms-compte-05",
    "ms-intrus-05",
    "ms-couleurs-03",
    "ms-morpion-02",
    "ms-suite-06",
    "ms-suite-nature-03",
    "ms-compte-06",
    "ms-formes-03",
    "ms-robot-03",
    "ms-intrus-06",
    "ms-tri-03",
    "ms-suite-07",
    "ms-suite-08",
    "ms-code-03",
    "ms-memoire-01",
    "ms-ranger-01",
    "ms-labyrinthe-01",
    "ms-memoire-02",
    "ms-robot-04",
    "ms-ranger-02",
    "ms-labyrinthe-02",
    "ms-intrus-07",
    "ms-memoire-03",
    "ms-code-04",
    "ms-ranger-03",
    "ms-labyrinthe-03",
    "ms-suite-09",
    "ms-memoire-04",
    "ms-morpion-03",
    "ms-ranger-04",
    "ms-labyrinthe-04",
    "ms-ranger-05",
    "ms-memoire-05",
    "ms-robot-05"
  ]
}
