{
  "$schema": "../track.schema.json",
  "id": "ce1",
  "title": "CE1",
  "minStarsToUnlockNext": 1,
  "levels": [
    "ce1-add-01",
    "ce1-suite-01",
    "ce1-compare-01",
    "ce1-mots-s1-1",
    "ce1-morpion-01",
    "ce1-lire-01",
    "ce1-sous-01",
    "ce1-suite-02",
    "ce1-mots-s1-2",
    "ce1-nombre-01",
    "ce1-tables-01",
    "ce1-add-02",
    "ce1-lire-02",
    "ce1-mots-s1-3",
    "ce1-code-01",
    "ce1-compare-02",
    "ce1-suite-03",
    "ce1-sous-02",
    "ce1-mots-s1-4",
    "ce1-robot-01",
    "ce1-tables-02",
    "ce1-mots-s2-1",
    "ce1-add-03",
    "ce1-suite-04",
    "ce1-pendu-01",
    "ce1-lire-03",
    "ce1-compare-03",
    "ce1-mots-s2-2",
    "ce1-sous-03",
    "ce1-nombre-02",
    "ce1-tables-03",
    "ce1-suite-05",
    "ce1-add-04",
    "ce1-mots-s2-3",
    "ce1-code-02",
    "ce1-lire-04",
    "ce1-compare-04",
    "ce1-suite-06",
    "ce1-mots-s2-4",
    "ce1-robot-02",
    "ce1-sous-04",
    "ce1-mots-s3-1",
    "ce1-tables-04",
    "ce1-suite-07",
    "ce1-pendu-02",
    "ce1-add-05",
    "ce1-lire-05",
    "ce1-mots-s3-2",
    "ce1-compare-05",
    "ce1-nombre-03",
    "ce1-sous-05",
    "ce1-suite-08",
    "ce1-add-07",
    "ce1-mots-s3-3",
    "ce1-code-03",
    "ce1-tables-05",
    "ce1-sous-06",
    "ce1-suite-09",
    "ce1-mots-s3-4",
    "ce1-robot-03",
    "ce1-add-06",
    "ce1-mots-s4-1",
    "ce1-sous-07",
    "ce1-suite-10",
    "ce1-pendu-03",
    "ce1-compare-06",
    "ce1-lire-06",
    "ce1-mots-s4-2",
    "ce1-tables-06",
    "ce1-nombre-04",
    "ce1-suite-11",
    "ce1-mots-s4-3",
    "ce1-compare-07",
    "ce1-lire-07",
    "ce1-code-04",
    "ce1-tables-07",
    "ce1-mots-s4-4",
    "ce1-suite-12",
    "ce1-mots-revision",
    "ce1-robot-04"
  ]
}
